{
  "$schema": "https://json-schema.org/draft/2020-12/schema",
  "$id": "https://health.md/contracts/rollup-summary/v11/rollup-summary.schema.json",
  "title": "Health.md Apple wake-date range roll-up summary v11",
  "$defs": {
    "metric": {
      "type": "object",
      "additionalProperties": false,
      "required": [
        "key",
        "canonical_key",
        "display_name",
        "category",
        "unit",
        "rule",
        "primary_value",
        "days_counted",
        "statistics"
      ],
      "properties": {
        "key": {
          "type": "string",
          "minLength": 1
        },
        "canonical_key": {
          "type": "string",
          "minLength": 1
        },
        "display_name": {
          "type": "string",
          "minLength": 1
        },
        "category": {
          "type": "string",
          "minLength": 1
        },
        "unit": {
          "type": "string"
        },
        "rule": {
          "type": "string",
          "minLength": 1
        },
        "primary_value": {
          "type": "string"
        },
        "days_counted": {
          "type": "integer",
          "minimum": 1,
          "maximum": 10000
        },
        "statistics": {
          "type": "array",
          "items": {
            "type": "object",
            "additionalProperties": false,
            "required": [
              "name",
              "value"
            ],
            "properties": {
              "name": {
                "type": "string",
                "minLength": 1
              },
              "value": {
                "type": "string"
              }
            }
          }
        },
        "notes": {
          "type": [
            "string",
            "null"
          ]
        }
      }
    }
  },
  "type": "object",
  "additionalProperties": false,
  "required": [
    "schema",
    "schema_version",
    "type",
    "rollup_period",
    "period_id",
    "start_date",
    "end_date",
    "calendar_timezone",
    "days_expected",
    "days_counted",
    "coverage_percent",
    "source_schema",
    "source_schema_version",
    "rollup_rules_version",
    "generated_at",
    "source_dates",
    "units",
    "metrics",
    "categories",
    "schema_profile",
    "source_schema_profile",
    "time_context"
  ],
  "properties": {
    "schema": {
      "const": "healthmd.rollup_summary"
    },
    "schema_version": {
      "const": 11
    },
    "type": {
      "const": "health_rollup"
    },
    "rollup_period": {
      "const": "range"
    },
    "period_id": {
      "type": "string",
      "pattern": "^[0-9]{4}-[0-9]{2}-[0-9]{2}_to_[0-9]{4}-[0-9]{2}-[0-9]{2}$"
    },
    "start_date": {
      "type": "string",
      "format": "date"
    },
    "end_date": {
      "type": "string",
      "format": "date"
    },
    "calendar_timezone": {
      "type": "string",
      "minLength": 1,
      "maxLength": 64
    },
    "days_expected": {
      "type": "integer",
      "minimum": 1,
      "maximum": 10000
    },
    "days_counted": {
      "type": "integer",
      "minimum": 0,
      "maximum": 10000
    },
    "coverage_percent": {
      "type": "number",
      "minimum": 0,
      "maximum": 100
    },
    "source_schema": {
      "const": "healthmd.health_data"
    },
    "source_schema_version": {
      "const": 11
    },
    "rollup_rules_version": {
      "const": 11
    },
    "generated_at": {
      "type": "string",
      "format": "date-time"
    },
    "source_dates": {
      "type": "array",
      "uniqueItems": true,
      "maxItems": 10000,
      "items": {
        "type": "string",
        "format": "date"
      }
    },
    "units": {
      "type": "object",
      "propertyNames": {
        "type": "string",
        "minLength": 1
      },
      "additionalProperties": {
        "type": "string",
        "minLength": 1
      }
    },
    "metrics": {
      "type": "array",
      "minItems": 1,
      "items": {
        "$ref": "#/$defs/metric"
      }
    },
    "categories": {
      "type": "object",
      "minProperties": 1,
      "propertyNames": {
        "type": "string",
        "minLength": 1
      },
      "additionalProperties": {
        "type": "array",
        "minItems": 1,
        "items": {
          "$ref": "#/$defs/metric"
        }
      }
    },
    "schema_profile": {
      "const": "apple-rollup-v11"
    },
    "source_schema_profile": {
      "const": "apple-v11"
    },
    "time_context": {
      "type": "object",
      "additionalProperties": false,
      "required": [
        "calendar_timezone",
        "timestamp_timezone",
        "sleep_day_attribution",
        "sleep_owner_day_rule",
        "sleep_interval_clipping"
      ],
      "properties": {
        "calendar_timezone": {
          "type": "string",
          "minLength": 1,
          "maxLength": 64
        },
        "timestamp_timezone": {
          "const": "UTC"
        },
        "sleep_day_attribution": {
          "const": "morning_ends"
        },
        "sleep_owner_day_rule": {
          "const": "session_end_date"
        },
        "sleep_interval_clipping": {
          "const": "none"
        }
      }
    }
  }
}
